{
  "commands": [
    {
      "about": "Build a bundle (.tgz) with manifest and inputs",
      "args": [
        {
          "default": null,
          "help": "issues,docs",
          "kind": "value",
          "long": "include",
          "name": "include",
          "possible_values": null,
          "required": false,
          "short": null
        },
        {
          "default": null,
          "help": null,
          "kind": "value",
          "long": "out",
          "name": "out",
          "possible_values": null,
          "required": false,
          "short": null
        },
        {
          "default": null,
          "help": null,
          "kind": "value",
          "long": null,
          "name": "arg3",
          "possible_values": null,
          "required": true,
          "short": null
        }
      ],
      "path": "bundle build",
      "plugin": "bundle",
      "toolspec": {
        "args_schema_ref": "schemas/bundle.build.args.json",
        "name": "bundle.build",
        "result_schema_ref": "schemas/bundle.build.result.json"
      },
      "usage": "nexoscli bundle build [flags]"
    },
    {
      "about": "Verify a bundle",
      "args": [
        {
          "default": null,
          "help": "Also verify current filesystem files match manifest",
          "kind": "value",
          "long": "against",
          "name": "against",
          "possible_values": null,
          "required": false,
          "short": null
        },
        {
          "default": null,
          "help": null,
          "kind": "value",
          "long": null,
          "name": "arg2",
          "possible_values": null,
          "required": true,
          "short": null
        }
      ],
      "path": "bundle verify",
      "plugin": "bundle",
      "toolspec": {
        "args_schema_ref": "schemas/bundle.verify.args.json",
        "name": "bundle.verify",
        "result_schema_ref": "schemas/bundle.verify.result.json"
      },
      "usage": "nexoscli bundle verify [flags]"
    },
    {
      "about": "Correlate Cline tasks to runs",
      "args": [
        {
          "default": null,
          "help": null,
          "kind": "flag",
          "long": "dry-run",
          "name": "dry-run",
          "possible_values": null,
          "required": false,
          "short": null
        },
        {
          "default": "5m",
          "help": null,
          "kind": "value",
          "long": "pad",
          "name": "pad",
          "possible_values": null,
          "required": false,
          "short": null
        },
        {
          "default": null,
          "help": null,
          "kind": "value",
          "long": "run-id",
          "name": "run-id",
          "possible_values": null,
          "required": false,
          "short": null
        },
        {
          "default": null,
          "help": null,
          "kind": "value",
          "long": "since",
          "name": "since",
          "possible_values": null,
          "required": false,
          "short": null
        },
        {
          "default": null,
          "help": null,
          "kind": "flag",
          "long": "write",
          "name": "write",
          "possible_values": null,
          "required": false,
          "short": null
        }
      ],
      "path": "cline correlate",
      "plugin": "cline",
      "toolspec": {
        "args_schema_ref": "schemas/cline.correlate.args.json",
        "name": "cline.correlate",
        "result_schema_ref": "schemas/cline.correlate.result.json"
      },
      "usage": "nexoscli cline correlate [flags]"
    },
    {
      "about": "Import tasks (read-only)",
      "args": [
        {
          "default": null,
          "help": null,
          "kind": "flag",
          "long": "dry-run",
          "name": "dry-run",
          "possible_values": null,
          "required": false,
          "short": null
        },
        {
          "default": null,
          "help": null,
          "kind": "value",
          "long": "limit",
          "name": "limit",
          "possible_values": null,
          "required": false,
          "short": null
        },
        {
          "default": null,
          "help": null,
          "kind": "value",
          "long": "since",
          "name": "since",
          "possible_values": null,
          "required": false,
          "short": null
        },
        {
          "default": null,
          "help": null,
          "kind": "value",
          "long": "storage",
          "name": "storage",
          "possible_values": null,
          "required": false,
          "short": null
        }
      ],
      "path": "cline import",
      "plugin": "cline",
      "toolspec": {
        "args_schema_ref": "schemas/cline.import.args.json",
        "name": "cline.import",
        "result_schema_ref": "schemas/cline.import.result.json"
      },
      "usage": "nexoscli cline import [flags]"
    },
    {
      "about": "Find Cline storage (globalStorage/workspace)",
      "args": [],
      "path": "cline locate",
      "plugin": "cline",
      "toolspec": {
        "args_schema_ref": "schemas/cline.locate.args.json",
        "name": "cline.locate",
        "result_schema_ref": "schemas/cline.locate.result.json"
      },
      "usage": "nexoscli cline locate [flags]"
    },
    {
      "about": "Normalize Cline tasks → AIM streams (.nexoscli/agents/streams/Cline/<task>/messages.ndjson)",
      "args": [
        {
          "default": null,
          "help": null,
          "kind": "flag",
          "long": "overwrite",
          "name": "overwrite",
          "possible_values": null,
          "required": false,
          "short": null
        },
        {
          "default": null,
          "help": null,
          "kind": "value",
          "long": "since",
          "name": "since",
          "possible_values": null,
          "required": false,
          "short": null
        },
        {
          "default": null,
          "help": null,
          "kind": "value",
          "long": "task-id",
          "name": "task-id",
          "possible_values": null,
          "required": false,
          "short": null
        }
      ],
      "path": "cline normalize",
      "plugin": "cline",
      "toolspec": null,
      "usage": "nexoscli cline normalize [flags]"
    },
    {
      "about": "Generate shell completions",
      "args": [
        {
          "default": null,
          "help": null,
          "kind": "value",
          "long": null,
          "name": "arg1",
          "possible_values": null,
          "required": true,
          "short": null
        }
      ],
      "path": "completions",
      "plugin": "completions",
      "toolspec": null,
      "usage": "nexoscli completions [flags]"
    },
    {
      "about": "Say hello from demo plugin",
      "args": [
        {
          "default": null,
          "help": "Optional recipient name",
          "kind": "value",
          "long": "name",
          "name": "name",
          "possible_values": null,
          "required": false,
          "short": null
        }
      ],
      "path": "demo hello",
      "plugin": "demo",
      "toolspec": {
        "args_schema_ref": "schemas/demo.hello.args.json",
        "name": "demo.hello",
        "result_schema_ref": "schemas/demo.hello.result.json"
      },
      "usage": "nexoscli demo hello [flags]"
    },
    {
      "about": "Generate CLI reference and Rules doc",
      "args": [
        {
          "default": null,
          "help": null,
          "kind": "flag",
          "long": "open",
          "name": "open",
          "possible_values": null,
          "required": false,
          "short": null
        }
      ],
      "path": "dev docs build",
      "plugin": "dev",
      "toolspec": null,
      "usage": "nexoscli dev docs build [flags]"
    },
    {
      "about": "Generate CLI reference/catalog and update plugin READMEs",
      "args": [
        {
          "default": null,
          "help": null,
          "kind": "flag",
          "long": "apply-readmes",
          "name": "apply-readmes",
          "possible_values": null,
          "required": false,
          "short": null
        },
        {
          "default": null,
          "help": "Ensure all ToolSpecs appear in catalog and vice-versa; exit non-zero on mismatch",
          "kind": "flag",
          "long": "check-parity",
          "name": "check-parity",
          "possible_values": null,
          "required": false,
          "short": null
        },
        {
          "default": null,
          "help": null,
          "kind": "value",
          "long": "out-json",
          "name": "out-json",
          "possible_values": null,
          "required": false,
          "short": null
        },
        {
          "default": null,
          "help": null,
          "kind": "value",
          "long": "out-md",
          "name": "out-md",
          "possible_values": null,
          "required": false,
          "short": null
        }
      ],
      "path": "dev docs commands",
      "plugin": "dev",
      "toolspec": null,
      "usage": "nexoscli dev docs commands [flags]"
    },
    {
      "about": "Environment & hygiene checks",
      "args": [
        {
          "default": null,
          "help": "Subset of checks: graph,plugins,config,events,tools,events-schema,events-chain,events-rotation,repo,plans,cline,rules (default: all)",
          "kind": "value",
          "long": "checks",
          "name": "checks",
          "possible_values": null,
          "required": false,
          "short": null
        },
        {
          "default": null,
          "help": "Aggregate repo checks and exit non-zero on failure",
          "kind": "flag",
          "long": "ci",
          "name": "ci",
          "possible_values": null,
          "required": false,
          "short": null
        },
        {
          "default": "json",
          "help": null,